City/Region,Attraction Name,Entrance Fee (KZT / USD),Opening Hours,Closed Days,Address,Google Maps Link,Distance from City Center (km / min),Parking / Shuttle Info,Top Photo Spots / Highlights,Short Description (for website),Seasonal Notes,Source / Verified Date
Aktau & Mangystau Region,Caspian Sea Promenade,Free,24/7,None,Aktau Seafront,https://www.google.com/maps/search/?api=1&query=Caspian%20Sea%20Promenade%20Aktau ,0–5 km / 5–15 min,Seafront parking,Seaside walkway; sunset views; cafes,Promenade along the Caspian with views and leisure areas.,Hot summers; windy.,"Needs verification - Nov 03, 2025"
Aktau & Mangystau Region,Rock Trail & Lighthouse area,Free,Daylight hours,None,"Lighthouse area, Aktau",https://www.google.com/maps/search/?api=1&query=Aktau%20lighthouse%20rock%20trail ,10–30 km / 15–45 min,Limited parking,Rock viewpoints; lighthouse,Coastal rock trails with a lighthouse backdrop for photos.,Tide and weather dependent.,"Needs verification - Nov 03, 2025"
Aktau & Mangystau Region,Bosphorus Canyon (Bozzhyra),1500 KZT / 3.19 USD,07:00–19:00,None,"Bozzhyra, Mangystau",https://www.google.com/maps/search/?api=1&query=Bozzhyra%20Bosphorus%20Canyon ,200–300 km / 4–6 h,Parking at trailheads,Dramatic rock pillars; panoramic cliffs,Remote canyon with otherworldly formations on Mangystau peninsula.,Remote; 4x4 recommended.,"Needs verification - Nov 03, 2025"
Aktau & Mangystau Region,Valley of Balls (Torysh),1500 KZT / 3.19 USD,08:00–18:00,None,"Torysh, Mangystau",https://www.google.com/maps/search/?api=1&query=Valley%20of%20Balls%20Torysh ,220–320 km / 4–6 h,Parking at site,Spherical concretions; desert landscape,Unique geological site with round stone formations in a desert setting.,Remote; off-road access.,"Needs verification - Nov 03, 2025"
Aktau & Mangystau Region,Zhygylgan Fault,Free,Daylight hours,None,Zhygylgan Fault area,https://www.google.com/maps/search/?api=1&query=Zhygylgan%20Fault%20Mangystau ,150–300 km / various,Sparse parking,Fault escarpments; panoramas,Geological fault features on the Mangystau peninsula.,Remote; bring supplies.,"Needs verification - Nov 03, 2025"
Aktau & Mangystau Region,Shakpak Ata Underground Mosque,800 KZT / 1.70 USD,09:00–18:00,None,"Shakpak Ata, Mangystau",https://www.google.com/maps/search/?api=1&query=Shakpak%20Ata%20Underground%20Mosque ,200–300 km / 4–6 h,Parking nearby,Underground mosque interior; rock passages,Historic underground mosque site with unique carved chambers.,Respect rules for sacred sites.,"Needs verification - Nov 03, 2025"
Aktau & Mangystau Region,Karagiye Depression,Free,Daylight hours,None,Karagiye Depression,https://www.google.com/maps/search/?api=1&query=Karagiye%20Depression%20Mangystau ,200–300 km / 4–6 h,No formal parking,Deep depression views; salt flats,One of the deepest depressions in the region with stark landscapes.,Remote and hot in summer.,"Needs verification - Nov 03, 2025"
Aktau & Mangystau Region,City Center Park & Eternal Flame Monument,Free,24/7,None,Aktau City Center,https://www.google.com/maps/search/?api=1&query=Aktau%20City%20Center%20Park%20Eternal%20Flame ,0–5 km / 5–15 min,City parking,Eternal Flame; city park; promenade,Central city park with monuments and green space in Aktau.,Good for evening strolls.,"Needs verification - Nov 03, 2025"