City/Region,Attraction Name,Entrance Fee (KZT / USD),Opening Hours,Closed Days,Address,Google Maps Link,Distance from City Center (km / min),Parking / Shuttle Info,Top Photo Spots / Highlights,Short Description (for website),Seasonal Notes,Source / Verified Date
Almaty Region,Kök Töbe Hill,"PP 2000 KZT/USD 3,74 OW (bus) PP 4500 KZT/USD 8,41 OW (cable-car)",11:00 - 22:00,No,"6XFF+WJP, Алматы",https://maps.app.goo.gl/QMmMvFqF6ykKpZaw9 ,: 13 min (4.1 km),300 ₸ (1st hr) + 100 ₸/hr,"Panoramic city view, Beatles monument, TV tower, viewing platforms","Perched on a leafy hill above Almaty, Kök Töbe Hill offers panoramic views of the city and neighboring Tien Shan peaks. Visitors can go up via cable-car or vehicle, take a leisurely walk through the hilltop park, snap photos next to The Beatles monument and soak in some panoramic sunset. A convenient stopover from the city centre at half time for the day.","Cable-car operates year round but times can be affected by maintenance or high winds — check in advance.
Recommended warm clothing in winter – the altitude and wind makes it seem colder still.
Snow/Ice for the drive up Snow or ice on the drive can make it longer.","Needs verification - Nov 03, 2025"
Almaty Region,Green Bazaar,Free ,07:00 - 19:00,Monday ,Jybek joly street 55 ,https://maps.app.goo.gl/vBBv5drnXfG2yBk87 ,"21 мин (9,9 км)",Mukagali Makataev Street 39 Parking 200 ₸ hr,"Сolorful fruit & spice stalls
Sweet section with chak-chak and baursak
Bazaar entrance faсade (Zenkov St)","Traditional market known for local fruits, spices, meats, and authentic Almaty atmosphere.",Noun ,"Needs verification - Nov 03, 2025"
Almaty Region,Panfilov Park & Zenkov Cathedral,Free ,07:00 - 19:00,No,"Gogol street 40в, Алматы 050010",https://maps.app.goo.gl/i5sP5UJR6ymU61of7 ,"19 мин (6,9 км)",Free parking,"Wooden Zenkov Cathedral (colorful facade), park alleys, WWII Memorial, Eternal Flame","One of Almaty’s most iconic landmarks — a peaceful park with the stunning Zenkov Cathedral, built entirely of wood without nails. Perfect for a calm walk and photos among tall trees.",Noun ,"Needs verification - Nov 03, 2025"
Almaty Region,Arbat Street ,Free ,09:00 - 00:00,No,Zhibek Zholy Street ,https://maps.app.goo.gl/FeGEdPki59FyLfZu9  ,"24 мин (6,1 км)",Street & mall parking available,"Arbat murals, street artists, cozy cafés, fountain area","Lively pedestrian zone in central Almaty with shopping, street art, and local cafés.",Noun ,"Needs verification - Nov 03, 2025"
Almaty Region,Almaty Central Mosque ,Free ,05:00 - 22:00,No,16 Pushkin Street,https://maps.app.goo.gl/kUtyvZaWdZDuaFaK6 ,"26 мин (7,1 км)",Parking available at entrance,"Mosque courtyard, golden dome, mountain view backdrop","The largest mosque in Almaty, known for its blue domes and serene interior. A place of calm reflection and elegant Islamic architecture.",Noun ,"Needs verification - Nov 03, 2025"
Almaty Region,Kazakh Museum of Folk Musical Instruments,PP 1500KZT/USD 3 ,10:00 - 18:00,Monday ,Zenkova st 24 ,https://maps.app.goo.gl/Eok2Jt7Y8C1Gi3Sd6 ,"23 мин. (10,2 км)",Limited parking near Panfilov Park,"Traditional dombras & kobyz instruments, wooden façade","Located in a charming wooden building in Panfilov Park, this museum showcases Kazakhstan’s traditional music and handcrafted instruments.",Noun ,"Needs verification - Nov 03, 2025"
Almaty Region,Republic Square & Independence Monument,Free ,24 H,No,"Satpaev St, Almaty",https://maps.app.goo.gl/RdMyxdNuYi7vfgsZ6  ,"16 мин. (4,3 км)",Street parking,"Independence Monument, fountains, government buildings","Central Almaty landmark symbolizing Kazakhstan’s independence, surrounded by fountains and city architecture — ideal for sunset photos.",Noun ,"Needs verification - Nov 03, 2025"
Almaty Region,Museum of Arts in Almaty ,PP 2000KZT/ USD 4,10:00 - 18:00,Monday ,"проспект Aль-Фараби, Алматы ",https://maps.app.goo.gl/pQQwmnD8AdosvkhU7,"28 мин. (6,0 км)",Museum parking available,"Main façade, modern Kazakh art exhibits","The largest art museum in Kazakhstan, displaying national and international collections of paintings, sculpture, and decorative arts.",Noun ,"Needs verification - Nov 03, 2025"
Almaty Region,Medeu Skating Rink,3500 KZT / 6.50 USD (winter season),10:00 – 22:00,None,"Gornaya St 465, Almaty",https://maps.app.goo.gl/zEPtFJtieBXEyhyN9 ,"21 мин. (11,6 км)","Paid parking, shuttle from city","Ice rink with mountain backdrop, viewpoint terrace","Famous high-altitude ice rink surrounded by mountains, popular for skating and panoramic views of Almaty valley.",Noun ,"Needs verification - Nov 03, 2025"
Almaty Region,Shymbulak Ski Resort,6000 KZT / 11.33 USD (cable car),09:00 – 18:00,None,"Gornaya St 640, Almaty",https://maps.app.goo.gl/zEPtFJtieBXEyhyN9 ,"21 мин. (11,6 км)",Parking & gondola from Medeu,"Cable car views, mountain slopes, cafés at top","Almaty’s premier ski resort with cable cars, restaurants, and scenic views year-round. Great for skiing, hiking, and dining above the clouds.",Noun ,"Needs verification - Nov 03, 2025"
Almaty Region,Big Almaty Lake,"Electro bike 25 000kzt/ 47,21 usd - free on walk ",24/7 (road access limited in winter),None,Ile-Alatau National Park,https://maps.app.goo.gl/LLM2d2TYmsNGUtP59 ,"1 ч 36 мин. (36,4 км)",Parking at viewpoint area,"Turquoise lake, mountain reflections, photo terrace",Stunning alpine lake located in the mountains above Almaty — famous for its changing turquoise color and breathtaking scenery.,Noun ,"Needs verification - Nov 03, 2025"
Almaty Region,Alma-Arasan Hot Springs,Free ,09:00 – 20:00,None,"Alma-Arasan Gorge, Almaty",https://maps.app.goo.gl/AB3p9LF6zdmSh2WY9 ,"57 мин. (22,0 км)","Small parking, limited shuttle access","Natural pools, riverside rocks, forest views","Natural hot springs hidden in the mountains, offering outdoor relaxation with mineral waters and a peaceful forest setting.",Noun ,"Needs verification - Nov 03, 2025"
Almaty Region,Turgen Gorge & Waterfall,Free ,09:00 – 20:00,None,"Turgen Village, Almaty Region",https://maps.app.goo.gl/FVjHqqn2Qm1gTNHZ7 ,"2 ч 45 мин. (92,7 км) ",Parking near entrance,"Waterfall bridge, forest trail, photo viewpoint","Scenic mountain gorge with lush forests, trout farms, and the famous Bear Waterfall — perfect for day trips from Almaty.",Noun ,"Needs verification - Nov 03, 2025"
Almaty Region,Issyk Lake,Free ,09:00 – 19:00,None,"Issyk Village, Almaty Region",https://maps.app.goo.gl/MKEjxZpKmXpGuZzAA ,"2 ч 25 мин. (73,0 км)",Parking at lake entrance,"Lake pier, viewpoint from hill, turquoise water shots","Beautiful mountain lake surrounded by pine forests, offering picnic areas and peaceful nature views near the ancient Issyk burial mounds.",Noun ,"Needs verification - Nov 03, 2025"
Almaty Region,Tamgaly Tas Petroglyphs,3000 KZT / 6 USD for car,09:00–18:00,None,Ili River area,https://www.google.com/maps/search/?api=1&query=Tamgaly%20Tas%20Petroglyphs ,120 km / 2 h,Parking at site,Rock carvings; river backdrop,Ancient petroglyphs and rock inscriptions along the Ili River.,Protected area; avoid touching carvings.,"Needs verification - Nov 03, 2025"
Almaty Region,Charyn Canyon,2750 KZT / 5.14 USD for car,08:00–19:00,None,"Charyn Canyon, Charyn National Park",https://www.google.com/maps/search/?api=1&query=Charyn%20Canyon ,200 km / 3–4 h,Parking at visitor area,Red rock formations; Valley of Castles viewpoint,Dramatic red-rock canyon often visited on day trips from Almaty.,Hot in summer; bring sun protection and water.,"Needs verification - Nov 03, 2025"
Almaty Region,Kolsai & Kaindy Lakes,2750 KZT / 5.14 USD for car,08:00–18:00,None,Kolsai & Kaindy area,https://www.google.com/maps/search/?api=1&query=Kolsai%20Kaindy%20Lakes ,300 km / 5+ h,Parking at trailheads,Alpine lakes; submerged forests; pine scenery,Series of stunning alpine lakes with walking trails and camping.,Roads long; best late spring–early autumn.,"Needs verification - Nov 03, 2025"
Almaty Region,Saty Village,Free / local guesthouse fees,--,--,Saty (gateway to Kolsai),https://www.google.com/maps/search/?api=1&query=Saty%20Village%20Kazakhstan ,290 km / 4.5 h,Guesthouse parking,Village streets; guesthouse fronts,Small mountain village serving as the gateway to Kolsai and Kaindy lakes.,Basic services; seasonal tourism.,"Needs verification - Nov 03, 2025"
Almaty Region,Asy Plateau,Free,--,--,Asy Plateau area,https://www.google.com/maps/search/?api=1&query=Asy%20Plateau%20Kazakhstan ,120 km / 3 h,Sparse parking,Wide plateau views; nomadic camps,High-altitude plateau with panoramic views and nomadic culture experiences.,Windy and cold outside summer months.,"Needs verification - Nov 03, 2025"
Almaty Region,Altyn-Emel National Park,1500 KZT / 3 USD,08:00–18:00,None,Altyn-Emel NP,https://www.google.com/maps/search/?api=1&query=Altyn%20Emel%20National%20Park ,250 km / 4 h,Visitor center parking,Singing Dune; Aktau rocks; kulan sightings,"Protected park with unique landscapes including singing dunes and ancient petroglyphs.  Then there are two directions you can go: (1) Aktau mountain (75km one way), or (2) Singing Dune (50km one way). For the first one you need 4x4 car, crossover (like Hyundai Tucson) is ok, no need for car like Land Cruiser. After rain the road might get a bit challenging, so if the rain was in the night you might leave the first route for the afternoon to let the ground dry a bit. Second route is more accessible, given good weather conditions (no heavy rains) it is feasible to make it with city car. ",Hot in summer days; remote — bring supplies.,"Needs verification - Nov 03, 2025"